[
  {
    "id": "c01_e01_b01",
    "expedition_id": "c01_e01",
    "battle_index": 1,
    "chapter": 1,
    "environment_asset_id": "env_fields",
    "pattern_id": "militia_patrol",
    "player_base_hp": 900,
    "enemy_base_hp": 650,
    "enemy_stat_multiplier": 1.0,
    "enemy_supply_start": 70,
    "enemy_supply_rate_per_s": 4.5,
    "enemy_supply_cap": 200,
    "enemy_total_supply_budget": 215,
    "enemy_first_deployment_earliest_s": 8,
    "enemy_min_deployment_gap_s": 1.2,
    "enemy_spawn_queue": [
      "militia",
      "militia",
      "militia",
      "crossbowman",
      "militia",
      "shieldguard",
      "militia",
      "militia"
    ],
    "boss_variant": null,
    "boss_queue_replacement": null,
    "boss_reveal_lead_s": 3,
    "win_medals": 10,
    "loss_medals": 0,
    "target_seconds": [
      45,
      90
    ],
    "status": "LOCKED_B001_NOT_COMBAT_SIMULATED",
    "enemy_orders_expire_at_s": 180,
    "enemy_rally": false,
    "policy": "FINITE_ORDERED_QUEUE",
    "adaptive_counter_selection": false,
    "boss_queue_index_zero_based": null,
    "minimum_funding_only_last_deployment_s": 32.25,
    "schedule_note": "Funding/minimum-gap calculation only; live-unit congestion can delay deployment. Orders not executed before180s expire with no delayed burst."
  },
  {
    "id": "c01_e01_b02",
    "expedition_id": "c01_e01",
    "battle_index": 2,
    "chapter": 1,
    "environment_asset_id": "env_fields",
    "pattern_id": "shield_line",
    "player_base_hp": 900,
    "enemy_base_hp": 650,
    "enemy_stat_multiplier": 1.0,
    "enemy_supply_start": 70,
    "enemy_supply_rate_per_s": 4.5,
    "enemy_supply_cap": 200,
    "enemy_total_supply_budget": 650,
    "enemy_first_deployment_earliest_s": 3,
    "enemy_min_deployment_gap_s": 1.2,
    "enemy_spawn_queue": [
      "shieldguard",
      "crossbowman",
      "militia",
      "shieldguard",
      "crossbowman",
      "militia",
      "shieldguard",
      "crossbowman",
      "shieldguard",
      "crossbowman",
      "militia",
      "shieldguard",
      "crossbowman",
      "militia",
      "shieldguard",
      "crossbowman"
    ],
    "boss_variant": null,
    "boss_queue_replacement": null,
    "boss_reveal_lead_s": 3,
    "win_medals": 10,
    "loss_medals": 0,
    "target_seconds": [
      90,
      150
    ],
    "status": "LOCKED_B001_NOT_COMBAT_SIMULATED",
    "enemy_orders_expire_at_s": 180,
    "enemy_rally": false,
    "policy": "FINITE_ORDERED_QUEUE",
    "adaptive_counter_selection": false,
    "boss_queue_index_zero_based": null,
    "minimum_funding_only_last_deployment_s": 128.9,
    "schedule_note": "Funding/minimum-gap calculation only; live-unit congestion can delay deployment. Orders not executed before180s expire with no delayed burst."
  },
  {
    "id": "c01_e01_b03",
    "expedition_id": "c01_e01",
    "battle_index": 3,
    "chapter": 1,
    "environment_asset_id": "env_fields",
    "pattern_id": "swarm",
    "player_base_hp": 900,
    "enemy_base_hp": 650,
    "enemy_stat_multiplier": 1.0,
    "enemy_supply_start": 70,
    "enemy_supply_rate_per_s": 4.5,
    "enemy_supply_cap": 200,
    "enemy_total_supply_budget": 460,
    "enemy_first_deployment_earliest_s": 3,
    "enemy_min_deployment_gap_s": 1.2,
    "enemy_spawn_queue": [
      "militia",
      "militia",
      "militia",
      "grenadier",
      "militia",
      "militia",
      "militia",
      "shieldguard",
      "militia",
      "militia",
      "militia",
      "grenadier",
      "militia",
      "militia",
      "militia",
      "shieldguard"
    ],
    "boss_variant": null,
    "boss_queue_replacement": null,
    "boss_reveal_lead_s": 3,
    "win_medals": 10,
    "loss_medals": 0,
    "target_seconds": [
      90,
      150
    ],
    "status": "LOCKED_B001_NOT_COMBAT_SIMULATED",
    "enemy_orders_expire_at_s": 180,
    "enemy_rally": false,
    "policy": "FINITE_ORDERED_QUEUE",
    "adaptive_counter_selection": false,
    "boss_queue_index_zero_based": null,
    "minimum_funding_only_last_deployment_s": 86.7,
    "schedule_note": "Funding/minimum-gap calculation only; live-unit congestion can delay deployment. Orders not executed before180s expire with no delayed burst."
  },
  {
    "id": "c01_e01_b04",
    "expedition_id": "c01_e01",
    "battle_index": 4,
    "chapter": 1,
    "environment_asset_id": "env_fields",
    "pattern_id": "shield_line",
    "player_base_hp": 900,
    "enemy_base_hp": 800,
    "enemy_stat_multiplier": 1.0,
    "enemy_supply_start": 70,
    "enemy_supply_rate_per_s": 4.9,
    "enemy_supply_cap": 200,
    "enemy_total_supply_budget": 650,
    "enemy_first_deployment_earliest_s": 3,
    "enemy_min_deployment_gap_s": 1.2,
    "enemy_spawn_queue": [
      "shieldguard",
      "crossbowman",
      "militia",
      "shieldguard",
      "crossbowman",
      "militia",
      "shieldguard",
      "crossbowman",
      "shieldguard",
      "crossbowman",
      "militia",
      "shieldguard",
      "crossbowman",
      "militia",
      "shieldguard",
      "crossbowman"
    ],
    "boss_variant": null,
    "boss_queue_replacement": null,
    "boss_reveal_lead_s": 3,
    "win_medals": 10,
    "loss_medals": 0,
    "target_seconds": [
      120,
      180
    ],
    "status": "LOCKED_B001_NOT_COMBAT_SIMULATED",
    "enemy_orders_expire_at_s": 180,
    "enemy_rally": false,
    "policy": "FINITE_ORDERED_QUEUE",
    "adaptive_counter_selection": false,
    "boss_queue_index_zero_based": null,
    "minimum_funding_only_last_deployment_s": 118.4,
    "schedule_note": "Funding/minimum-gap calculation only; live-unit congestion can delay deployment. Orders not executed before180s expire with no delayed burst."
  },
  {
    "id": "c01_e02_b01",
    "expedition_id": "c01_e02",
    "battle_index": 1,
    "chapter": 1,
    "environment_asset_id": "env_fields",
    "pattern_id": "shield_line",
    "player_base_hp": 900,
    "enemy_base_hp": 685,
    "enemy_stat_multiplier": 1.0,
    "enemy_supply_start": 70,
    "enemy_supply_rate_per_s": 4.75,
    "enemy_supply_cap": 200,
    "enemy_total_supply_budget": 650,
    "enemy_first_deployment_earliest_s": 3,
    "enemy_min_deployment_gap_s": 1.2,
    "enemy_spawn_queue": [
      "shieldguard",
      "crossbowman",
      "militia",
      "shieldguard",
      "crossbowman",
      "militia",
      "shieldguard",
      "crossbowman",
      "shieldguard",
      "crossbowman",
      "militia",
      "shieldguard",
      "crossbowman",
      "militia",
      "shieldguard",
      "crossbowman"
    ],
    "boss_variant": null,
    "boss_queue_replacement": null,
    "boss_reveal_lead_s": 3,
    "win_medals": 10,
    "loss_medals": 0,
    "target_seconds": [
      90,
      150
    ],
    "status": "LOCKED_B001_NOT_COMBAT_SIMULATED",
    "enemy_orders_expire_at_s": 180,
    "enemy_rally": false,
    "policy": "FINITE_ORDERED_QUEUE",
    "adaptive_counter_selection": false,
    "boss_queue_index_zero_based": null,
    "minimum_funding_only_last_deployment_s": 122.15,
    "schedule_note": "Funding/minimum-gap calculation only; live-unit congestion can delay deployment. Orders not executed before180s expire with no delayed burst."
  },
  {
    "id": "c01_e02_b02",
    "expedition_id": "c01_e02",
    "battle_index": 2,
    "chapter": 1,
    "environment_asset_id": "env_fields",
    "pattern_id": "swarm",
    "player_base_hp": 900,
    "enemy_base_hp": 685,
    "enemy_stat_multiplier": 1.0,
    "enemy_supply_start": 70,
    "enemy_supply_rate_per_s": 4.75,
    "enemy_supply_cap": 200,
    "enemy_total_supply_budget": 460,
    "enemy_first_deployment_earliest_s": 3,
    "enemy_min_deployment_gap_s": 1.2,
    "enemy_spawn_queue": [
      "militia",
      "militia",
      "militia",
      "grenadier",
      "militia",
      "militia",
      "militia",
      "shieldguard",
      "militia",
      "militia",
      "militia",
      "grenadier",
      "militia",
      "militia",
      "militia",
      "shieldguard"
    ],
    "boss_variant": null,
    "boss_queue_replacement": null,
    "boss_reveal_lead_s": 3,
    "win_medals": 10,
    "loss_medals": 0,
    "target_seconds": [
      90,
      150
    ],
    "status": "LOCKED_B001_NOT_COMBAT_SIMULATED",
    "enemy_orders_expire_at_s": 180,
    "enemy_rally": false,
    "policy": "FINITE_ORDERED_QUEUE",
    "adaptive_counter_selection": false,
    "boss_queue_index_zero_based": null,
    "minimum_funding_only_last_deployment_s": 82.15,
    "schedule_note": "Funding/minimum-gap calculation only; live-unit congestion can delay deployment. Orders not executed before180s expire with no delayed burst."
  },
  {
    "id": "c01_e02_b03",
    "expedition_id": "c01_e02",
    "battle_index": 3,
    "chapter": 1,
    "environment_asset_id": "env_fields",
    "pattern_id": "artillery",
    "player_base_hp": 900,
    "enemy_base_hp": 685,
    "enemy_stat_multiplier": 1.0,
    "enemy_supply_start": 70,
    "enemy_supply_rate_per_s": 4.75,
    "enemy_supply_cap": 200,
    "enemy_total_supply_budget": 720,
    "enemy_first_deployment_earliest_s": 3,
    "enemy_min_deployment_gap_s": 1.2,
    "enemy_spawn_queue": [
      "shieldguard",
      "grenadier",
      "militia",
      "crossbowman",
      "shieldguard",
      "grenadier",
      "militia",
      "crossbowman",
      "shieldguard",
      "grenadier",
      "militia",
      "crossbowman",
      "shieldguard",
      "grenadier",
      "militia",
      "crossbowman"
    ],
    "boss_variant": null,
    "boss_queue_replacement": null,
    "boss_reveal_lead_s": 3,
    "win_medals": 10,
    "loss_medals": 0,
    "target_seconds": [
      90,
      150
    ],
    "status": "LOCKED_B001_NOT_COMBAT_SIMULATED",
    "enemy_orders_expire_at_s": 180,
    "enemy_rally": false,
    "policy": "FINITE_ORDERED_QUEUE",
    "adaptive_counter_selection": false,
    "boss_queue_index_zero_based": null,
    "minimum_funding_only_last_deployment_s": 136.85,